zone_id,name,lat,lon,radius_km,risk_type,severity,description,impact,related_commodities,recommended_response
Z_BS,Black Sea conflict risk zone,45.0,32.0,280,conflict,88,Military activity and export disruption risk in north-west Black Sea approaches.,"Delays, higher insurance, possible diversions for grain from Ukraine.","wheat,maize,sunflower_oil",Monitor AIS; prefer insured tonnage; consider alternative corridors.
Z_RS,Red Sea security risk,18.0,40.0,220,security,76,Elevated maritime security incidents affecting Suez–Bab el-Mandeb corridor.,Schedule slippage and canal transit uncertainty.,all_consignments,Coordinate with operators; update ETAs to Egyptian ports.
Z_EMD,Eastern Mediterranean tension,35.5,28.0,200,geopolitical,62,Strategic shipping density and periodic air-naval activity east of Crete.,Route uncertainty for Aegean–Egypt lanes.,"wheat,veg_oil",Maintain communications watch; use suggested safer waypoints.
Z_SUEZ,Suez Canal congestion risk,30.0,32.55,80,chokepoint,55,Queues and pilot availability can delay convoys.,Knock-on delays for Egypt-bound arrivals.,all,Pre-clear documentation; pad logistics buffers.
Z_UA_EXP,Ukraine export disruption,46.5,31.5,150,sanctions_sensitive,72,Policy and military risk around key export load ports.,Wheat and maize loading uncertainty.,"wheat,maize",Diversify origins; track charter-party clauses.
Z_ME,Middle East instability band,33.0,36.0,260,instability,58,Broader regional instability affecting eastern Med relay routes.,Fuel and schedule volatility.,food_bulk,Higher monitoring frequency for laden inbound vessels.
